{
  "schema_version": "aos.envelope.overlay.v1",
  "type": "task",
  "id": "task_sorcerer_0001",
  "bundle_id": "bundle_demo_v1",
  "project": {
    "project_id": "project_demo",
    "episode_id": "episode_0001"
  },
  "target": {
    "role": "Sorcerer",
    "domain": "aos.domain.Core",
    "urn": "urn:aos:agent:sorcerer.core.v1"
  },
  "transport": {
    "vport": "aos.vport.sorcerer.v1",
    "callback_id": "cb_002",
    "protocol_version": "mcp.v1",
    "communication_pattern": "request_response"
  },
  "payload": {
    "inputs": {
      "intent": "draft",
      "objective": "Draft a README intro for AoS Standard App v1",
      "materials": {
        "bullets": [
          "Schema-first",
          "Deterministic runtime",
          "vPort registry"
        ]
      }
    },
    "constraints": {}
  },
  "trace": {
    "correlation_id": "demo-sorcerer-1"
  }
}
