{
  "schema_version": "aos.envelope.overlay.v1",
  "type": "task",
  "id": "task_foreman_0001",
  "bundle_id": "bundle_demo_v1",
  "project": {
    "project_id": "project_demo",
    "episode_id": "episode_0001"
  },
  "target": {
    "role": "Foreman",
    "domain": "aos.domain.Core",
    "urn": "urn:aos:agent:foreman.core.v1"
  },
  "transport": {
    "vport": "aos.vport.foreman.v1",
    "callback_id": "cb_001",
    "protocol_version": "mcp.v1",
    "communication_pattern": "request_response"
  },
  "payload": {
    "inputs": {
      "intent": "plan",
      "objective": "Create a v1 repo plan for AoS standard app",
      "requested_outputs": [
        "repo_tree",
        "schemas",
        "handlers"
      ]
    },
    "constraints": {
      "deterministic": true,
      "max_steps": 25
    }
  },
  "trace": {
    "correlation_id": "demo-foreman-1"
  }
}
